Title;Title_link;Thumbnail;detail-price;feedback-txt;tag-item
Ugreen Car Phone Holder for Your Mobile Phone Holder Stand for iPhone 11 8 Air Vent Mount Cell Phone Support in Car Phone Stand;https://www.aliexpress.com/item/32626150303.html?gps-id=6038561&scm=1007.23961.125497.0&scm_id=1007.23961.125497.0&scm-url=1007.23961.125497.0&pvid=a6e2cfc5-c2ef-42a6-8984-0c2d7f0beeaa;https://ae01.alicdn.com/kf/Hdc150b4cd0eb4a3286cc0402c0f41dc8j.jpg_350x350.jpg;US $2.59;8752 avis positifs;RECOMMANDATION DU JOUR | - 45%
Portable Lint Remover Clothes Fuzz Fabric Shaver Brush Tool Power-Free Fluff Removing Roller for Sweater Woven Coat;https://www.aliexpress.com/item/4000369492502.html?gps-id=5950812&scm=1007.23961.125497.0&scm_id=1007.23961.125497.0&scm-url=1007.23961.125497.0&pvid=2dc2687b-60f6-4d16-9259-0e66fe8de7d9;https://ae01.alicdn.com/kf/Hab43b6b7e29c48d18faaf1e8be1298cel.jpg_350x350.jpg;US $0.01;3223 avis positifs;
Sandisk Micro SD Card 256G 200GB 128GB 64GB 100MB/S Memory card SD/TF Flash Card Class10 32GB 16GB microSD for Tablet/smartphone;https://www.aliexpress.com/item/32860178129.html?gps-id=5950812&scm=1007.23961.125497.0&scm_id=1007.23961.125497.0&scm-url=1007.23961.125497.0&pvid=2dc2687b-60f6-4d16-9259-0e66fe8de7d9;https://ae01.alicdn.com/kf/Hb5999b16768d4c7bbd73789eb3fa2a86s.jpg_350x350.jpg;US $2.81;1671 avis positifs;Free Return
Global Version Xiaomi Redmi Note 8 Pro 6GB 64GB Mobile Phone 64MP Quad Camera MTK Helio G90T Octa Core Smartphone 4500mAh NFC;https://www.aliexpress.com/item/4000147424812.html?gps-id=5950812&scm=1007.23961.125497.0&scm_id=1007.23961.125497.0&scm-url=1007.23961.125497.0&pvid=2dc2687b-60f6-4d16-9259-0e66fe8de7d9;https://ae01.alicdn.com/kf/H8e7c6f9a90714bdfa1a00d2e97226fc5T.jpg_350x350.jpg;US $212.00;25628 avis positifs;
Black warm pants winter skinny thick velvet wool fleece girls leggings women Trousers Lambskin Cashmere Pants For Women leggings;https://www.aliexpress.com/item/4000114443001.html?gps-id=5950812&scm=1007.23961.125497.0&scm_id=1007.23961.125497.0&scm-url=1007.23961.125497.0&pvid=2dc2687b-60f6-4d16-9259-0e66fe8de7d9;https://ae01.alicdn.com/kf/H106ae7610fc04028960048d358900ffcQ.jpg_350x350.jpg;US $17.85;9295 avis positifs;Free Return
NO.ONEPAUL Tactical belt Military high quality Nylon men's training belt metal multifunctional buckle outdoor sports hook new;https://www.aliexpress.com/item/33039492790.html?gps-id=5950812&scm=1007.23961.125497.0&scm_id=1007.23961.125497.0&scm-url=1007.23961.125497.0&pvid=2dc2687b-60f6-4d16-9259-0e66fe8de7d9;https://ae01.alicdn.com/kf/H73f2d7fcd7b2488bb3128f869ee02fe3j.jpg_350x350.jpg;US $6.42;17221 avis positifs;Free Return
ROHWXY SUN 5X Plus UV LED Lamp For Nails Dryer 54W/48W/36W Ice Lamp For Manicure Gel Nail Lamp Drying Lamp For Gel Varnish;https://www.aliexpress.com/item/32963316221.html?gps-id=5950812&scm=1007.23961.125497.0&scm_id=1007.23961.125497.0&scm-url=1007.23961.125497.0&pvid=2dc2687b-60f6-4d16-9259-0e66fe8de7d9;https://ae01.alicdn.com/kf/H28256715531144799218acd002e47191Q.jpg_350x350.jpg;US $12.84;14154 avis positifs;Free Return
Haylou GT1 TWS Fingerprint Touch Bluetooth Earphones, HD Stereo Wireless Headphones,Noise Cancelling Gaming Headset;https://www.aliexpress.com/item/32985243771.html?gps-id=5950812&scm=1007.23961.125497.0&scm_id=1007.23961.125497.0&scm-url=1007.23961.125497.0&pvid=2dc2687b-60f6-4d16-9259-0e66fe8de7d9;https://ae01.alicdn.com/kf/Ha02c5e414a524db698a26f9ce5822ad8f.jpg_350x350.jpg;US $18.61;36379 avis positifs;Free Return
In Stock Xiaomi Mi Band 4 Smart Miband 3 Color AMOLED Screen Bracelet Heart Rate Fitness Tracker Bluetooth5.0 Waterproof Miband4;https://www.aliexpress.com/item/33037922702.html?gps-id=5950812&scm=1007.23961.125497.0&scm_id=1007.23961.125497.0&scm-url=1007.23961.125497.0&pvid=2dc2687b-60f6-4d16-9259-0e66fe8de7d9;https://ae01.alicdn.com/kf/Hfe87b12a020b4632bb5871ce4c0b256cZ.jpg_350x350.jpg;US $25.10;92262 avis positifs;Free Return
CURREN Casual Sport Watches for Men Blue Top Brand Luxury Military Leather Wrist Watch Man Clock Fashion Chronograph Wristwatch;https://www.aliexpress.com/item/32982338666.html?gps-id=5950812&scm=1007.23961.125497.0&scm_id=1007.23961.125497.0&scm-url=1007.23961.125497.0&pvid=2dc2687b-60f6-4d16-9259-0e66fe8de7d9;https://ae01.alicdn.com/kf/H32a7ce5c30014391bfb80e312cd836dfO.jpg_350x350.jpg;US $23.99;15793 avis positifs;Free Return
Muscle Massage Gun Sport Therapy Massager Body Relaxation Pain Relief Slimming Shaping Massager 4 Heads With Bag;https://www.aliexpress.com/item/4000144320494.html?gps-id=5950812&scm=1007.23961.125497.0&scm_id=1007.23961.125497.0&scm-url=1007.23961.125497.0&pvid=2dc2687b-60f6-4d16-9259-0e66fe8de7d9;https://ae01.alicdn.com/kf/H761cea3c71c546d9af239c31fa7d9da8Y.jpg_350x350.jpg;US $48.50;1919 avis positifs;
PZOZ 1M 2M Magnetic Cable Micro usb Type C Fast Charging Microusb Type-C Magnet Charger Wire usb c For iphone 11 X Xr usb cable;https://www.aliexpress.com/item/32849697882.html?gps-id=5950812&scm=1007.23961.125497.0&scm_id=1007.23961.125497.0&scm-url=1007.23961.125497.0&pvid=2dc2687b-60f6-4d16-9259-0e66fe8de7d9;https://ae01.alicdn.com/kf/Hb3398430c01a4478b8f33ada1fe6f029b.jpg_350x350.jpg;US $0.77;76975 avis positifs;Free Return
Curren Woman Watches Rose Gold Top Brand Luxury Watch Women Quartz Waterproof Women's Wristwatch Ladies Girls Watches Clock;https://www.aliexpress.com/item/33027554480.html?gps-id=5950812&scm=1007.23961.125497.0&scm_id=1007.23961.125497.0&scm-url=1007.23961.125497.0&pvid=2dc2687b-60f6-4d16-9259-0e66fe8de7d9;https://ae01.alicdn.com/kf/HTB1KObRaB1D3KVjSZFyq6zuFpXaq.jpg_350x350.jpg;US $16.95;215 avis positifs;Free Return
HALOQUEEN Short Human Hair Wigs Peruvian Body Wave Wig Hair Pre-Plucked Hairline Wavy 8-14 Inch Short Bob Lace Closure Wigs;https://www.aliexpress.com/item/4000035059629.html?gps-id=5950812&scm=1007.23961.125497.0&scm_id=1007.23961.125497.0&scm-url=1007.23961.125497.0&pvid=496614a0-f894-48ff-acbe-6ec33cf52fc2;https://ae01.alicdn.com/kf/Hca4d21ff01ec46a296758ee4d0b99375b.jpg_350x350.jpg;US $49.53;711 avis positifs;Free Return
Baseus Quick Charge 4.0 3.0 USB Car Charger For iPhone Xiaomi Huawei QC4.0 QC3.0 QC Auto Type C PD Fast Car Mobile Phone Charger;https://www.aliexpress.com/item/32970589225.html?gps-id=5950812&scm=1007.23961.125497.0&scm_id=1007.23961.125497.0&scm-url=1007.23961.125497.0&pvid=496614a0-f894-48ff-acbe-6ec33cf52fc2;https://ae01.alicdn.com/kf/H926f467b0ab84ca4958a9c8913d6bb41o.jpg_350x350.jpg;US $4.92;14688 avis positifs;Free Return
Simenual Workout Active Wear Ribbed Rompers Womens Jumpsuit Sporty Long Sleeve Fitness Embroidery Letter Print Zipper Jumpsuits;https://www.aliexpress.com/item/4000283199334.html?gps-id=5950812&scm=1007.23961.125497.0&scm_id=1007.23961.125497.0&scm-url=1007.23961.125497.0&pvid=496614a0-f894-48ff-acbe-6ec33cf52fc2;https://ae01.alicdn.com/kf/Hea24a12b2963484a852c4c99cf1c977bA.jpg_350x350.jpg;US $14.74;493 avis positifs;Free Return
Wholesale 30 pairs no box Mikiwi Eyelashes 3D Mink Lashes Handmade Dramatic Lashes 32 styles cruelty free mink lashes;https://www.aliexpress.com/item/32961886786.html?gps-id=5950812&scm=1007.23961.125497.0&scm_id=1007.23961.125497.0&scm-url=1007.23961.125497.0&pvid=496614a0-f894-48ff-acbe-6ec33cf52fc2;https://ae01.alicdn.com/kf/HTB16CV8vYvpK1RjSZFqq6AXUVXai.jpg_350x350.jpg;US $43.44;756 avis positifs;Free Return
2019 winter jacket parka for boys coats ,90% down girls jackets children's clothing snow wear kids outerwear toddler boy clothes;https://www.aliexpress.com/item/32749018490.html?gps-id=5950812&scm=1007.23961.125497.0&scm_id=1007.23961.125497.0&scm-url=1007.23961.125497.0&pvid=496614a0-f894-48ff-acbe-6ec33cf52fc2;https://ae01.alicdn.com/kf/HTB1JuzHd2WG3KVjSZFPq6xaiXXa4.jpg_350x350.jpg;US $45.45;284 avis positifs;Free Return
Essager Magnetic Micro USB Cable For iPhone Samsung Fast Charging Data Wire Cord Magnet Charger USB Type C 3m Mobile Phone Cable;https://www.aliexpress.com/item/1000006327495.html?gps-id=5950812&scm=1007.23961.125497.0&scm_id=1007.23961.125497.0&scm-url=1007.23961.125497.0&pvid=496614a0-f894-48ff-acbe-6ec33cf52fc2;https://ae01.alicdn.com/kf/H897788aedbe54f339f3be08702a1d5e5y.jpg_350x350.jpg;US $0.01;54306 avis positifs;Free Return
2019 5PCS/Lot Baby Boys Clothes Unicorn Girls Clothing Bodysuits Baby Girls Clothes  0-12M Newborn 100%Cotton Roupas de bebe;https://www.aliexpress.com/item/33026838069.html?gps-id=5950812&scm=1007.23961.125497.0&scm_id=1007.23961.125497.0&scm-url=1007.23961.125497.0&pvid=496614a0-f894-48ff-acbe-6ec33cf52fc2;https://ae01.alicdn.com/kf/H0023c29f0466444aafb9d4fb8235deda6.jpg_350x350.jpg;US $9.39;969 avis positifs;Free Return
"IN STOCK UMIDIGI F2 Android 10 Global Version 6.53""FHD+6GB 128GB 48MP AI Quad Camera 32MP Selfie Helio P70 Cellphone 5150mAh NFC";https://www.aliexpress.com/item/4000178715895.html?gps-id=5950812&scm=1007.23961.125497.0&scm_id=1007.23961.125497.0&scm-url=1007.23961.125497.0&pvid=496614a0-f894-48ff-acbe-6ec33cf52fc2;https://i.alicdn.com/ae-channel-ui/2.0.0/common/img/placeholder.png;US $197.49;8330 avis positifs;
LAZAWG Women Waist Trainer Neoprene Belt Weight Loss Cincher Body Shaper Tummy Control Strap Slimming Sweat Fat Burning Girdle;https://www.aliexpress.com/item/33015895924.html?gps-id=5950812&scm=1007.23961.125497.0&scm_id=1007.23961.125497.0&scm-url=1007.23961.125497.0&pvid=496614a0-f894-48ff-acbe-6ec33cf52fc2;https://i.alicdn.com/ae-channel-ui/2.0.0/common/img/placeholder.png;US $10.08;4171 avis positifs;
YI 1080p Home Camera Indoor IP Security Surveillance System with Night Vision for Home/Office/Baby/Nanny/Pet Monitor iOS Android;https://www.aliexpress.com/item/32675845174.html?gps-id=5950812&scm=1007.23961.125497.0&scm_id=1007.23961.125497.0&scm-url=1007.23961.125497.0&pvid=496614a0-f894-48ff-acbe-6ec33cf52fc2;https://i.alicdn.com/ae-channel-ui/2.0.0/common/img/placeholder.png;US $22.00;1430 avis positifs;fast shipping
Dropshipping Digital Thermometer Infrared Baby Adult Forehead Non-contact Infrared Thermometer With LCD Backlight Termometro;https://www.aliexpress.com/item/32909555524.html?gps-id=5950812&scm=1007.23961.125497.0&scm_id=1007.23961.125497.0&scm-url=1007.23961.125497.0&pvid=496614a0-f894-48ff-acbe-6ec33cf52fc2;https://i.alicdn.com/ae-channel-ui/2.0.0/common/img/placeholder.png;US $11.00;;Free Return
KSR914 Smart Watch Fitness Tracker Men Women Wearable Devices Smart Band Heart Rate Monitor ECG Detection  Smart Bracelet;https://www.aliexpress.com/item/10000010369154.html?gps-id=5950812&scm=1007.23961.125497.0&scm_id=1007.23961.125497.0&scm-url=1007.23961.125497.0&pvid=496614a0-f894-48ff-acbe-6ec33cf52fc2;https://i.alicdn.com/ae-channel-ui/2.0.0/common/img/placeholder.png;US $28.31;625 avis positifs;Free Return
"IN STOCK UMIDIGI F2 Android 10 Global Version 6.53""FHD+6GB 128GB 48MP AI Quad Camera 32MP Selfie Helio P70 Cellphone 5150mAh NFC";https://www.aliexpress.com/item/4000178715895.html?gps-id=5950812&scm=1007.23961.125497.0&scm_id=1007.23961.125497.0&scm-url=1007.23961.125497.0&pvid=496614a0-f894-48ff-acbe-6ec33cf52fc2;https://ae01.alicdn.com/kf/Hc71b68e06fd049fbae8764e4f5af0c7as.jpg_350x350.jpg;US $197.49;8330 avis positifs;
LAZAWG Women Waist Trainer Neoprene Belt Weight Loss Cincher Body Shaper Tummy Control Strap Slimming Sweat Fat Burning Girdle;https://www.aliexpress.com/item/33015895924.html?gps-id=5950812&scm=1007.23961.125497.0&scm_id=1007.23961.125497.0&scm-url=1007.23961.125497.0&pvid=496614a0-f894-48ff-acbe-6ec33cf52fc2;https://ae01.alicdn.com/kf/HTB15XYnVNYaK1RjSZFnq6y80pXai.jpg_350x350.jpg;US $10.08;4171 avis positifs;
YI 1080p Home Camera Indoor IP Security Surveillance System with Night Vision for Home/Office/Baby/Nanny/Pet Monitor iOS Android;https://www.aliexpress.com/item/32675845174.html?gps-id=5950812&scm=1007.23961.125497.0&scm_id=1007.23961.125497.0&scm-url=1007.23961.125497.0&pvid=496614a0-f894-48ff-acbe-6ec33cf52fc2;https://ae01.alicdn.com/kf/H3c87d67a47bf45fcac25d7dd1a790e44Z.jpg_350x350.jpg;US $22.00;1430 avis positifs;fast shipping
Dropshipping Digital Thermometer Infrared Baby Adult Forehead Non-contact Infrared Thermometer With LCD Backlight Termometro;https://www.aliexpress.com/item/32909555524.html?gps-id=5950812&scm=1007.23961.125497.0&scm_id=1007.23961.125497.0&scm-url=1007.23961.125497.0&pvid=496614a0-f894-48ff-acbe-6ec33cf52fc2;https://ae01.alicdn.com/kf/HTB1_fy7cjbguuRkHFrdq6z.LFXaF.jpg_350x350.jpg;US $11.00;;Free Return
KSR914 Smart Watch Fitness Tracker Men Women Wearable Devices Smart Band Heart Rate Monitor ECG Detection  Smart Bracelet;https://www.aliexpress.com/item/10000010369154.html?gps-id=5950812&scm=1007.23961.125497.0&scm_id=1007.23961.125497.0&scm-url=1007.23961.125497.0&pvid=496614a0-f894-48ff-acbe-6ec33cf52fc2;https://ae01.alicdn.com/kf/H32792d057d3a46aa87a03f36f53951f31.jpg_350x350.jpg;US $28.31;625 avis positifs;Free Return
NO.ONEPAUL Tactical belt Military high quality Nylon men's training belt metal multifunctional buckle outdoor sports hook new;https://www.aliexpress.com/item/33039492790.html?gps-id=5950812&scm=1007.23961.125497.0&scm_id=1007.23961.125497.0&scm-url=1007.23961.125497.0&pvid=2dc2687b-60f6-4d16-9259-0e66fe8de7d9;https://ae01.alicdn.com/kf/H73f2d7fcd7b2488bb3128f869ee02fe3j.jpg_350x350.jpg;US $6.42;17221 avis positifs;Free Return
Jooan 8CH 1536P CCTV Wireless System Audio Record 4/8PCS 3.0MP Outdoor P2P Wifi IP Security Camera Set Video Surveillance Kit;https://www.aliexpress.com/item/4000373557617.html?gps-id=5950812&scm=1007.23961.125497.0&scm_id=1007.23961.125497.0&scm-url=1007.23961.125497.0&pvid=91abf63f-f122-41b0-bbe1-e123a49d6d3a;https://ae01.alicdn.com/kf/Hd522b31fc4f44be0adce4b611ed24bcbq.jpg_350x350.jpg;US $129.99;897 avis positifs;Free Return,fast shipping
316L stainless steel watchband bezel/case DW5600 GW5000 GW-M5610 metal strap steel belt tools for men/women gift;https://www.aliexpress.com/item/33042715860.html?gps-id=5950812&scm=1007.23961.125497.0&scm_id=1007.23961.125497.0&scm-url=1007.23961.125497.0&pvid=91abf63f-f122-41b0-bbe1-e123a49d6d3a;https://ae01.alicdn.com/kf/Hd61bcea09e4e4abe9cc3833bc296fd15k.jpg_350x350.jpg;US $24.40;220 avis positifs;
Stretch Slipcovers Sectional Elastic Stretch Sofa Cover for Living Room Couch Cover L shape Armchair Cover Single/Two/Three seat;https://www.aliexpress.com/item/32891782796.html?gps-id=5950812&scm=1007.23961.125497.0&scm_id=1007.23961.125497.0&scm-url=1007.23961.125497.0&pvid=91abf63f-f122-41b0-bbe1-e123a49d6d3a;https://ae01.alicdn.com/kf/HTB1nUwiQ7voK1RjSZPfq6xPKFXa1.jpg_350x350.jpg;US $12.54;7861 avis positifs;Free Return
Original 70mai Dash Cam Pro 1944P Speed & Coordinates GPS ADAS 70mai pro Car Dash Camera WiFi DVR Voice Control 24H Park 70 MAI;https://www.aliexpress.com/item/32931282121.html?gps-id=5950812&scm=1007.23961.125497.0&scm_id=1007.23961.125497.0&scm-url=1007.23961.125497.0&pvid=91abf63f-f122-41b0-bbe1-e123a49d6d3a;https://ae01.alicdn.com/kf/H9267b7e27d374c4cae42b11dcb7f25a9R.jpg_350x350.jpg;US $59.99;16444 avis positifs;Free Return,fast shipping
COLMI P8 1.4 inch Smart Watch Men Full Touch Fitness Tracker Blood Pressure Smart Clock Women GTS Smartwatch for Xiaomi;https://www.aliexpress.com/item/4000548862852.html?gps-id=5950812&scm=1007.23961.125497.0&scm_id=1007.23961.125497.0&scm-url=1007.23961.125497.0&pvid=91abf63f-f122-41b0-bbe1-e123a49d6d3a;https://ae01.alicdn.com/kf/Hc887078b7b5b44bdb30177cabd657537A.jpg_350x350.jpg;US $24.69;1169 avis positifs;
Original LCD For Samsung Galaxy S8 Lcd Display S8 plus G950 G950F G955fd G955F G955 With Burn Shadow With Touch Screen Digitize;https://www.aliexpress.com/item/32972179848.html?gps-id=5950812&scm=1007.23961.125497.0&scm_id=1007.23961.125497.0&scm-url=1007.23961.125497.0&pvid=91abf63f-f122-41b0-bbe1-e123a49d6d3a;https://ae01.alicdn.com/kf/H14389b52e3f9408eb97b6cf3e4c448d9N.jpg_350x350.jpg;US $78.02;1463 avis positifs;Free Return
PZOZ usb cable for iphone cable 11 pro max Xs Xr X 8 7 6 plus 6s 5s plus ipad air mini 4 fast charging cables For iphone charger;https://www.aliexpress.com/item/32632635156.html?gps-id=5950812&scm=1007.23961.125497.0&scm_id=1007.23961.125497.0&scm-url=1007.23961.125497.0&pvid=91abf63f-f122-41b0-bbe1-e123a49d6d3a;https://ae01.alicdn.com/kf/H7ba757c3adba4414a6bcb5c34c11e9e0g.jpg_350x350.jpg;US $0.01;25718 avis positifs;Free Return
30cm Rose Pink Silk Peony Artificial Flowers Bouquet 5 Big Head and 4 Bud Cheap Fake Flowers for Home Wedding Decoration indoor;https://www.aliexpress.com/item/32880916034.html?gps-id=5950812&scm=1007.23961.125497.0&scm_id=1007.23961.125497.0&scm-url=1007.23961.125497.0&pvid=91abf63f-f122-41b0-bbe1-e123a49d6d3a;https://ae01.alicdn.com/kf/HTB1.xESmvuSBuNkHFqDq6xfhVXat.jpg_350x350.jpg;US $0.01;14948 avis positifs;
Eachine E520S E520 GPS FOLLOW ME WIFI FPV Quadcopter With 4K/1080P HD Wide Angle Camera Foldable Altitude Hold Durable RC Drone;https://www.aliexpress.com/item/4000016604997.html?gps-id=5950812&scm=1007.23961.125497.0&scm_id=1007.23961.125497.0&scm-url=1007.23961.125497.0&pvid=91abf63f-f122-41b0-bbe1-e123a49d6d3a;https://ae01.alicdn.com/kf/Hf860e0eba9c6455c9a6f6479bf205bdb1.jpg_350x350.jpg;US $47.93;5305 avis positifs;Free Return,fast shipping
Yesello Plus Size M-5XL Summer Hole Ripped Jeans Women Jeggings Cool Denim High Waist Skinny Jeans Pants Pencil Trousers Black;https://www.aliexpress.com/item/32892728979.html?gps-id=5950812&scm=1007.23961.125497.0&scm_id=1007.23961.125497.0&scm-url=1007.23961.125497.0&pvid=91abf63f-f122-41b0-bbe1-e123a49d6d3a;https://i.alicdn.com/ae-channel-ui/2.0.0/common/img/placeholder.png;US $13.07;1261 avis positifs;
Transparent Magic Nano Tape Washable Reusable Double-Sided Tape Adhesive Nano-No Trace Paste Removable Glue Cleanable Household;https://www.aliexpress.com/item/4000198089081.html?gps-id=5950812&scm=1007.23961.125497.0&scm_id=1007.23961.125497.0&scm-url=1007.23961.125497.0&pvid=91abf63f-f122-41b0-bbe1-e123a49d6d3a;https://i.alicdn.com/ae-channel-ui/2.0.0/common/img/placeholder.png;US $1.58;8501 avis positifs;Free Return
Yesello Plus Size M-5XL Summer Hole Ripped Jeans Women Jeggings Cool Denim High Waist Skinny Jeans Pants Pencil Trousers Black;https://www.aliexpress.com/item/32892728979.html?gps-id=5950812&scm=1007.23961.125497.0&scm_id=1007.23961.125497.0&scm-url=1007.23961.125497.0&pvid=91abf63f-f122-41b0-bbe1-e123a49d6d3a;https://ae01.alicdn.com/kf/HTB1Fac0D_tYBeNjy1Xdq6xXyVXa4.jpg_350x350.jpg;US $13.07;1261 avis positifs;
Transparent Magic Nano Tape Washable Reusable Double-Sided Tape Adhesive Nano-No Trace Paste Removable Glue Cleanable Household;https://www.aliexpress.com/item/4000198089081.html?gps-id=5950812&scm=1007.23961.125497.0&scm_id=1007.23961.125497.0&scm-url=1007.23961.125497.0&pvid=91abf63f-f122-41b0-bbe1-e123a49d6d3a;https://ae01.alicdn.com/kf/H5bcee3515b4c46c48c9b8d4489d8bfc74.jpg_350x350.jpg;US $1.58;8501 avis positifs;Free Return
Cigfun X-Buds TWS Bluetooth Earphone Mini Wireless Earbuds IPX5 Waterproof Sports Stereo Headset with Mic For Xiaomi Phone;https://www.aliexpress.com/item/4000272776310.html?gps-id=5950812&scm=1007.23961.125497.0&scm_id=1007.23961.125497.0&scm-url=1007.23961.125497.0&pvid=a294640c-237b-4953-a908-0347dc97cb0a;https://ae01.alicdn.com/kf/Hf4ae1111d8394e088936940d3f437e41i.jpg_350x350.jpg;US $28.00;1099 avis positifs;Free Return
Outdoor PTZ Wireless  CCTV IP Camera Wifi Move Detection Infrared Night Vision Waterproof Surveillance RJ45/Wifi Dome Camera;https://www.aliexpress.com/item/4000165617227.html?gps-id=5950812&scm=1007.23961.125497.0&scm_id=1007.23961.125497.0&scm-url=1007.23961.125497.0&pvid=a294640c-237b-4953-a908-0347dc97cb0a;https://ae01.alicdn.com/kf/H08a7c6a6b17b4117ae567311a773887d1.jpg_350x350.jpg;US $31.00;2380 avis positifs;
Visofree 30/40 Pairs/lot 3D Mink Lashes With Tray No Box Handmade Full Strip Lashes Mink False Eyelashes Makeup eyelashes cilios;https://www.aliexpress.com/item/32952001154.html?gps-id=5950812&scm=1007.23961.125497.0&scm_id=1007.23961.125497.0&scm-url=1007.23961.125497.0&pvid=a294640c-237b-4953-a908-0347dc97cb0a;https://ae01.alicdn.com/kf/HTB10gSrasrrK1Rjy1zeq6xalFXa8.jpg_350x350.jpg;US $39.99;315 avis positifs;
Baby Boy Clothing Set Cute Summer T-Shirt Cartoon Children Boys Clothes Shorts Suit for Kids Outfit Denim Outfit;https://www.aliexpress.com/item/33001741058.html?gps-id=5950812&scm=1007.23961.125497.0&scm_id=1007.23961.125497.0&scm-url=1007.23961.125497.0&pvid=a294640c-237b-4953-a908-0347dc97cb0a;https://ae01.alicdn.com/kf/HTB1iGO4T3HqK1RjSZFPq6AwapXaq.jpg_350x350.jpg;US $8.69;580 avis positifs;Free Return
Autumn Winter Thicker Warm Velvet Childs Kids Faux Fur Pompom Beanies Hats 2018 Soft Newborn baby Boys Girls Toddler Cotton Hats;https://www.aliexpress.com/item/32955246658.html?gps-id=5950812&scm=1007.23961.125497.0&scm_id=1007.23961.125497.0&scm-url=1007.23961.125497.0&pvid=a294640c-237b-4953-a908-0347dc97cb0a;https://ae01.alicdn.com/kf/H0431e6c01f024aa6825a065e0b8f43c9c.jpg_350x350.jpg;US $3.99;1495 avis positifs;
Most Powerful LED Headlight headlamp 5LED T6 Head Lamp Power Flashlight Torch head light 18650 battery Best For Camping, fishing;https://www.aliexpress.com/item/33031657263.html?gps-id=5950812&scm=1007.23961.125497.0&scm_id=1007.23961.125497.0&scm-url=1007.23961.125497.0&pvid=a294640c-237b-4953-a908-0347dc97cb0a;https://ae01.alicdn.com/kf/Hb0912c83d87b4073a34d47522b10f9052.jpg_350x350.jpg;US $6.83;8276 avis positifs;Free Return
20/20 Design Polarized Tr90 Sunglasses Spring Hinge Temple UV400 Lens Eyewear For Man Woman Sun Glasses oculos gafas OC7008;https://www.aliexpress.com/item/4000478395568.html?gps-id=5950812&scm=1007.23961.125497.0&scm_id=1007.23961.125497.0&scm-url=1007.23961.125497.0&pvid=a294640c-237b-4953-a908-0347dc97cb0a;https://ae01.alicdn.com/kf/H47b507b93edc40cf9a4de04387a09581x.jpg_350x350.jpg;US $11.74;136 avis positifs;Free Return
Knife Sharpener 3 Stages Professional Kitchen Sharpening Stone Grinder knives Whetstone Tungsten Diamond Ceramic Sharpener Tool;https://www.aliexpress.com/item/32838478497.html?gps-id=5950812&scm=1007.23961.125497.0&scm_id=1007.23961.125497.0&scm-url=1007.23961.125497.0&pvid=a294640c-237b-4953-a908-0347dc97cb0a;https://ae01.alicdn.com/kf/HTB19WyjXyYrK1Rjy0Fdq6ACvVXax.jpg_350x350.jpg;US $6.79;16627 avis positifs;Free Return
TintonLife 220V/110V Household Food Vacuum Sealer Packaging Machine Film Sealer Vacuum Packer Including 15Pcs Bags;https://www.aliexpress.com/item/32614020998.html?gps-id=5950812&scm=1007.23961.125497.0&scm_id=1007.23961.125497.0&scm-url=1007.23961.125497.0&pvid=a294640c-237b-4953-a908-0347dc97cb0a;https://ae01.alicdn.com/kf/HTB1pY17X5nrK1Rjy1Xcq6yeDVXao.jpg_350x350.jpg;US $14.68;9003 avis positifs;Free Return,fast shipping
Simenual Sporty Fashion Active Wear Black Fitness Tracksuits One Shoulder 2 Piece Set Women Workout Crop Top And Leggings Sets;https://www.aliexpress.com/item/33013513034.html?gps-id=5950812&scm=1007.23961.125497.0&scm_id=1007.23961.125497.0&scm-url=1007.23961.125497.0&pvid=a294640c-237b-4953-a908-0347dc97cb0a;https://ae01.alicdn.com/kf/HTB1dxkyVAvoK1RjSZFNq6AxMVXaE.jpg_350x350.jpg;US $12.63;256 avis positifs;Free Return
Nail Set UV LED Lamp Dryer With 18/12/10pcs Nail Gel Polish Kit Soak Off Manicure Tools Set electric Nail drill For Nail Tools;https://www.aliexpress.com/item/32964785488.html?gps-id=5950812&scm=1007.23961.125497.0&scm_id=1007.23961.125497.0&scm-url=1007.23961.125497.0&pvid=a294640c-237b-4953-a908-0347dc97cb0a;https://ae01.alicdn.com/kf/H9f96422718584912ae875607fd357507k.jpg_350x350.jpg;US $18.25;9311 avis positifs;Free Return
HLXG Mini Canbus lampada H4 H7 LED Car Headlight 12V 10000LM 4300K 6000K 8000K Lamp H3 H1 9005 HB3 9006 HB4 H8 H9 H11 light Bulb;https://www.aliexpress.com/item/32832975978.html?gps-id=5950812&scm=1007.23961.125497.0&scm_id=1007.23961.125497.0&scm-url=1007.23961.125497.0&pvid=a294640c-237b-4953-a908-0347dc97cb0a;https://ae01.alicdn.com/kf/H159ca80328e04c1b843f88f94a8e20142.jpg_350x350.jpg;US $7.12;10223 avis positifs;
Sapphire Straight Bundles With Closure Brazilian Hair Weave Bundles With Closure Human Hair Bundles With Closure Hair Extension;https://www.aliexpress.com/item/32840627909.html?gps-id=5950812&scm=1007.23961.125497.0&scm_id=1007.23961.125497.0&scm-url=1007.23961.125497.0&pvid=6fec9545-809a-4fc3-8d4c-ca76d6288624;https://ae01.alicdn.com/kf/H0729d093e3344df5b852f9fd2c1257c0V.jpg_350x350.jpg;US $43.68;1879 avis positifs;
Xiaomi Mi Band 4 Smart Bracelet 3 Color AMOLED Screen Miband 4 Smartband Fitness Traker Bluetooth Sport Waterproof Smart Band;https://www.aliexpress.com/item/33034288052.html?gps-id=5950812&scm=1007.23961.125497.0&scm_id=1007.23961.125497.0&scm-url=1007.23961.125497.0&pvid=6fec9545-809a-4fc3-8d4c-ca76d6288624;https://ae01.alicdn.com/kf/Hbf8694d0fd76478880330ad435b87818y.jpg_350x350.jpg;US $24.60;72927 avis positifs;
Li-Ning Men's ROUGE RABBIT 2016 Running Shoes NO CHIP Sneakers Cushioning Breathable LiNing Comfort Sport Shoes ARBK079 XYP391;https://www.aliexpress.com/item/4000155340190.html?gps-id=5950812&scm=1007.23961.125497.0&scm_id=1007.23961.125497.0&scm-url=1007.23961.125497.0&pvid=6fec9545-809a-4fc3-8d4c-ca76d6288624;https://ae01.alicdn.com/kf/HTB1zzf3PpXXXXcXaXXXq6xXFXXXV.jpg_350x350.jpg;US $34.64;502 avis positifs;Free Return
2020 print leggings high waist pants Ankle-Length Pants 7/8 capris pants Pencil yoga skinny Pants;https://www.aliexpress.com/item/32945927022.html?gps-id=5950812&scm=1007.23961.125497.0&scm_id=1007.23961.125497.0&scm-url=1007.23961.125497.0&pvid=6fec9545-809a-4fc3-8d4c-ca76d6288624;https://ae01.alicdn.com/kf/H36868f86b16d4fe1b6efe1db90892a5cH.jpg_350x350.jpg;US $19.87;346 avis positifs;
