Title;Title_link;Thumbnail;detail-price;feedback-txt;tag-item
ZNP 1m 2m Micro USB Cable Fast Charging For Xiaomi Redmi Note 5 Pro Android Mobile Phone Data Cable for Samsung S7 Micro Charger;https://www.aliexpress.com/item/32996600477.html?gps-id=5950812&scm=1007.23961.125497.0&scm_id=1007.23961.125497.0&scm-url=1007.23961.125497.0&pvid=6fec9545-809a-4fc3-8d4c-ca76d6288624;https://ae01.alicdn.com/kf/HTB1NLZjVwHqK1RjSZFPq6AwapXav.jpg_350x350.jpg;US $0.94;69578 avis positifs;
SeaKnight MONSTER W8 Fishing Line 150M 300M 500M 8 Strands Braided Fishing Line Multifilament PE Line 15 20 30 40 50 80 100LB;https://www.aliexpress.com/item/32864568537.html?gps-id=5950812&scm=1007.23961.125497.0&scm_id=1007.23961.125497.0&scm-url=1007.23961.125497.0&pvid=6fec9545-809a-4fc3-8d4c-ca76d6288624;https://ae01.alicdn.com/kf/H6559fa8a965843a880f0b91492b04878t.jpg_350x350.jpg;US $8.12;5301 avis positifs;Free Return
Джинсы женские свободные с высокой талией и карманами;https://www.aliexpress.com/item/4000395547719.html?gps-id=5950812&scm=1007.23961.125497.0&scm_id=1007.23961.125497.0&scm-url=1007.23961.125497.0&pvid=6fec9545-809a-4fc3-8d4c-ca76d6288624;https://i.alicdn.com/ae-channel-ui/2.0.0/common/img/placeholder.png;US $15.56;170 avis positifs;Free Return
Dog Car Seat Cover View Mesh Waterproof Pet Carrier Car Rear Back Seat Mat Hammock Cushion Protector With Zipper And Pockets;https://www.aliexpress.com/item/32964803636.html?gps-id=5950812&scm=1007.23961.125497.0&scm_id=1007.23961.125497.0&scm-url=1007.23961.125497.0&pvid=6fec9545-809a-4fc3-8d4c-ca76d6288624;https://i.alicdn.com/ae-channel-ui/2.0.0/common/img/placeholder.png;US $28.15;1220 avis positifs;fast shipping
Goodland 100 LED Solar Light Outdoor Solar Lamp Powered Sunlight Waterproof PIR Motion Sensor Street Light for Garden Decoration;https://www.aliexpress.com/item/33053778984.html?gps-id=5950812&scm=1007.23961.125497.0&scm_id=1007.23961.125497.0&scm-url=1007.23961.125497.0&pvid=6fec9545-809a-4fc3-8d4c-ca76d6288624;https://i.alicdn.com/ae-channel-ui/2.0.0/common/img/placeholder.png;US $4.44;3835 avis positifs;Free Return
Dropshipping Lash lift Kit Makeupbemine Eyelash Perming Kit ICONSIGN Lashes Perm Set Can Do Your Logo And Ship By Fast Shippment;https://www.aliexpress.com/item/32856003453.html?gps-id=5950812&scm=1007.23961.125497.0&scm_id=1007.23961.125497.0&scm-url=1007.23961.125497.0&pvid=6fec9545-809a-4fc3-8d4c-ca76d6288624;https://i.alicdn.com/ae-channel-ui/2.0.0/common/img/placeholder.png;US $11.55;3194 avis positifs;Free Return,fast shipping
Original folk style women's retro stitching old cotton and linen material shift pants women loose large size baggy pants;https://www.aliexpress.com/item/4000118776812.html?gps-id=5950812&scm=1007.23961.125497.0&scm_id=1007.23961.125497.0&scm-url=1007.23961.125497.0&pvid=6fec9545-809a-4fc3-8d4c-ca76d6288624;https://i.alicdn.com/ae-channel-ui/2.0.0/common/img/placeholder.png;US $33.33;653 avis positifs;
"In Stock Global ROM Xiaomi Redmi Note 7 6GB RAM 64GB ROM Smartphone Snapdragon 660 6.3"" Screen 48MP Rear Camera 4000mAh Battery";https://www.aliexpress.com/item/32969447445.html?gps-id=5950812&scm=1007.23961.125497.0&scm_id=1007.23961.125497.0&scm-url=1007.23961.125497.0&pvid=6fec9545-809a-4fc3-8d4c-ca76d6288624;https://i.alicdn.com/ae-channel-ui/2.0.0/common/img/placeholder.png;US $138.79;7954 avis positifs;
Джинсы женские свободные с высокой талией и карманами;https://www.aliexpress.com/item/4000395547719.html?gps-id=5950812&scm=1007.23961.125497.0&scm_id=1007.23961.125497.0&scm-url=1007.23961.125497.0&pvid=6fec9545-809a-4fc3-8d4c-ca76d6288624;https://ae01.alicdn.com/kf/H39b94b29f03140739a62f03a1d3d963bM.jpg_350x350.jpg;US $15.56;170 avis positifs;Free Return
Dog Car Seat Cover View Mesh Waterproof Pet Carrier Car Rear Back Seat Mat Hammock Cushion Protector With Zipper And Pockets;https://www.aliexpress.com/item/32964803636.html?gps-id=5950812&scm=1007.23961.125497.0&scm_id=1007.23961.125497.0&scm-url=1007.23961.125497.0&pvid=6fec9545-809a-4fc3-8d4c-ca76d6288624;https://ae01.alicdn.com/kf/HTB1uRMdacnrK1RjSspkq6yuvXXaC.jpg_350x350.jpg;US $28.15;1220 avis positifs;fast shipping
Goodland 100 LED Solar Light Outdoor Solar Lamp Powered Sunlight Waterproof PIR Motion Sensor Street Light for Garden Decoration;https://www.aliexpress.com/item/33053778984.html?gps-id=5950812&scm=1007.23961.125497.0&scm_id=1007.23961.125497.0&scm-url=1007.23961.125497.0&pvid=6fec9545-809a-4fc3-8d4c-ca76d6288624;https://ae01.alicdn.com/kf/Hafcb22532138450696886571b17659bfz.jpg_350x350.jpg;US $4.44;3835 avis positifs;Free Return
Dropshipping Lash lift Kit Makeupbemine Eyelash Perming Kit ICONSIGN Lashes Perm Set Can Do Your Logo And Ship By Fast Shippment;https://www.aliexpress.com/item/32856003453.html?gps-id=5950812&scm=1007.23961.125497.0&scm_id=1007.23961.125497.0&scm-url=1007.23961.125497.0&pvid=6fec9545-809a-4fc3-8d4c-ca76d6288624;https://ae01.alicdn.com/kf/H5af40fac22494dba9f03f8df1c969702U.jpg_350x350.jpg;US $11.55;3194 avis positifs;Free Return,fast shipping
Original folk style women's retro stitching old cotton and linen material shift pants women loose large size baggy pants;https://www.aliexpress.com/item/4000118776812.html?gps-id=5950812&scm=1007.23961.125497.0&scm_id=1007.23961.125497.0&scm-url=1007.23961.125497.0&pvid=6fec9545-809a-4fc3-8d4c-ca76d6288624;https://ae01.alicdn.com/kf/Hc3c53432ba424a36aa1c6f4ae9c80beeg.jpg_350x350.jpg;US $33.33;653 avis positifs;
"In Stock Global ROM Xiaomi Redmi Note 7 6GB RAM 64GB ROM Smartphone Snapdragon 660 6.3"" Screen 48MP Rear Camera 4000mAh Battery";https://www.aliexpress.com/item/32969447445.html?gps-id=5950812&scm=1007.23961.125497.0&scm_id=1007.23961.125497.0&scm-url=1007.23961.125497.0&pvid=6fec9545-809a-4fc3-8d4c-ca76d6288624;https://ae01.alicdn.com/kf/H22bd578b4f874659b38bf60c3f08b3c0A.jpg_350x350.jpg;US $138.79;7954 avis positifs;
ROHWXY SUN 5X Plus UV LED Lamp For Nails Dryer 54W/48W/36W Ice Lamp For Manicure Gel Nail Lamp Drying Lamp For Gel Varnish;https://www.aliexpress.com/item/32963316221.html?gps-id=5950812&scm=1007.23961.125497.0&scm_id=1007.23961.125497.0&scm-url=1007.23961.125497.0&pvid=2dc2687b-60f6-4d16-9259-0e66fe8de7d9;https://ae01.alicdn.com/kf/H28256715531144799218acd002e47191Q.jpg_350x350.jpg;US $12.84;14154 avis positifs;Free Return
ZNP USB Type C Cable For Samsung S10 Huawei P30 Pro Fast Charge Type-C Mobile Phone Charging Wire USB C Cable for Samsung S9 S8;https://www.aliexpress.com/item/32997902868.html?gps-id=5950812&scm=1007.23961.125497.0&scm_id=1007.23961.125497.0&scm-url=1007.23961.125497.0&pvid=d466b0e0-ca41-4311-83b4-3c6da6b8492e;https://ae01.alicdn.com/kf/HTB1btkgVyrpK1RjSZFhq6xSdXXaC.jpg_350x350.jpg;US $0.94;61092 avis positifs;
Zircon Tennis Letters Necklaces & Pendant For Men/Women Gold Silver Color Fashion Hip Hop Jewelry with 4mm Tennis Chain;https://www.aliexpress.com/item/32954313320.html?gps-id=5950812&scm=1007.23961.125497.0&scm_id=1007.23961.125497.0&scm-url=1007.23961.125497.0&pvid=d466b0e0-ca41-4311-83b4-3c6da6b8492e;https://ae01.alicdn.com/kf/HTB12wbsX6nuK1RkSmFPq6AuzFXar.jpg_350x350.jpg;US $22.45;475 avis positifs;Free Return
Acrylic Nail Art Kit Manicure Set 12 Colors Nail Glitter Powder Decoration Acrylic Pen Brush Nail Art Tool Kit For Beginners;https://www.aliexpress.com/item/32849344604.html?gps-id=5950812&scm=1007.23961.125497.0&scm_id=1007.23961.125497.0&scm-url=1007.23961.125497.0&pvid=d466b0e0-ca41-4311-83b4-3c6da6b8492e;https://ae01.alicdn.com/kf/Hdb8eb783f520484cbaa61809d71a6df1Q.jpg_350x350.jpg;US $11.37;914 avis positifs;Free Return
Global Version Xiaomi Redmi 8 4 GB 64 GB Octa-core Snapdragon 439 processor 12 MP dual camera Smartphone  5000 mAh Redmi 8;https://www.aliexpress.com/item/4000251305046.html?gps-id=5950812&scm=1007.23961.125497.0&scm_id=1007.23961.125497.0&scm-url=1007.23961.125497.0&pvid=d466b0e0-ca41-4311-83b4-3c6da6b8492e;https://ae01.alicdn.com/kf/H8ba1830f46b14511832b7f352731a32bM.jpg_350x350.jpg;US $519.99;213 avis positifs;
Missblue 32 34 36 38 40 Inch Brazilian Hair Weave Bundles Straight 100% Human Hair Bundles 3 4 Pieces Natural Color Remy Hair;https://www.aliexpress.com/item/32983336258.html?gps-id=5950812&scm=1007.23961.125497.0&scm_id=1007.23961.125497.0&scm-url=1007.23961.125497.0&pvid=d466b0e0-ca41-4311-83b4-3c6da6b8492e;https://ae01.alicdn.com/kf/HTB1EwS0LpzqK1RjSZFCq6zbxVXaN.jpg_350x350.jpg;US $12.59;2335 avis positifs;
TG113C Column Portable Bluetooth Mini Speaker with FM Radio Subwoofer Wireless Loundpeakers &Phone Holder 9 Colors;https://www.aliexpress.com/item/33001532730.html?gps-id=5950812&scm=1007.23961.125497.0&scm_id=1007.23961.125497.0&scm-url=1007.23961.125497.0&pvid=d466b0e0-ca41-4311-83b4-3c6da6b8492e;https://ae01.alicdn.com/kf/H2be41390cecc46888039258d74b79336l.jpg_350x350.jpg;US $16.11;5281 avis positifs;
Caiwei S6W Portable Pocket Mini 3D DLP Projector LED Home Cinema Support HD Video  WIFI Mobile Beamer For Smartphone Projectors;https://www.aliexpress.com/item/32999284201.html?gps-id=5950812&scm=1007.23961.125497.0&scm_id=1007.23961.125497.0&scm-url=1007.23961.125497.0&pvid=d466b0e0-ca41-4311-83b4-3c6da6b8492e;https://ae01.alicdn.com/kf/Hcfdc89676b0a4727afbfbe3943475a65h.jpg_350x350.jpg;US $276.07;1852 avis positifs;Free Return
5 Pairs Cotton Women Socks Solid Snowflake Softable funny Socks Women Summer Slipper Socks Hot Sale;https://www.aliexpress.com/item/33006451827.html?gps-id=5950812&scm=1007.23961.125497.0&scm_id=1007.23961.125497.0&scm-url=1007.23961.125497.0&pvid=d466b0e0-ca41-4311-83b4-3c6da6b8492e;https://ae01.alicdn.com/kf/H9e3436a8f67e4ddd86a12511efffbecey.jpg_350x350.jpg;US $3.39;1328 avis positifs;
Original Xiaomi Mi Band 4 Smart Bluetooth 5.0 Wristband Fitness Bracelet AMOLED Color Touch Screen Music AI Heart Rate;https://www.aliexpress.com/item/33030441233.html?gps-id=5950812&scm=1007.23961.125497.0&scm_id=1007.23961.125497.0&scm-url=1007.23961.125497.0&pvid=d466b0e0-ca41-4311-83b4-3c6da6b8492e;https://ae01.alicdn.com/kf/HTB1egWVbEGF3KVjSZFvq6z_nXXaq.jpg_350x350.jpg;US $22.61;4690 avis positifs;
KINGSEVEN Men Vintage Aluminum Polarized Sunglasses Classic Brand Sun glasses Coating Lens Driving Eyewear For Men/Women;https://www.aliexpress.com/item/32793775351.html?gps-id=5950812&scm=1007.23961.125497.0&scm_id=1007.23961.125497.0&scm-url=1007.23961.125497.0&pvid=d466b0e0-ca41-4311-83b4-3c6da6b8492e;https://ae01.alicdn.com/kf/HTB1rBY6XLLsK1Rjy0Fbq6xSEXXaG.jpg_350x350.jpg;US $11.79;12510 avis positifs;Free Return
40Pcs/lot Fine Cheap Velvet Elastic Hair Bands Scrunchy Hair Rope for Women Girls Hair Grooming Accessories Whoelsale 30H;https://www.aliexpress.com/item/33041805306.html?gps-id=5950812&scm=1007.23961.125497.0&scm_id=1007.23961.125497.0&scm-url=1007.23961.125497.0&pvid=d466b0e0-ca41-4311-83b4-3c6da6b8492e;https://ae01.alicdn.com/kf/HTB1JhEkaA9E3KVjSZFGq6A19XXas.jpg_350x350.jpg;US $7.20;1975 avis positifs;
Tangada black suit pants woman high waist pants sashes pockets office ladies pants fashion middle aged pink yellow pants 6A22;https://www.aliexpress.com/item/32915448119.html?gps-id=5950812&scm=1007.23961.125497.0&scm_id=1007.23961.125497.0&scm-url=1007.23961.125497.0&pvid=2b5b0ad0-2dff-4150-9508-61045ce04922;https://ae01.alicdn.com/kf/HTB1ZtgeKeuSBuNjSsziq6zq8pXa0.jpg_350x350.jpg;US $13.86;4626 avis positifs;Free Return
LIFFLY Dubai Jewelry Sets Big Necklace Classic Water Drop Shape Bracelet Earrings Ring for Women Wedding Jewelry Sets for Bride;https://www.aliexpress.com/item/4000097899343.html?gps-id=5950812&scm=1007.23961.125497.0&scm_id=1007.23961.125497.0&scm-url=1007.23961.125497.0&pvid=2b5b0ad0-2dff-4150-9508-61045ce04922;https://ae01.alicdn.com/kf/H8cf4403c9ab741c8ba0562203dfd5bfdm.jpg_350x350.jpg;US $10.89;887 avis positifs;Free Return
2020 Women's Loafers flat Shoes Zapatos De Mujer Autumn  Round  Ballerine Femme Tenis Feminino Casual Black Ladies weaving;https://www.aliexpress.com/item/4000485825542.html?gps-id=5950812&scm=1007.23961.125497.0&scm_id=1007.23961.125497.0&scm-url=1007.23961.125497.0&pvid=2b5b0ad0-2dff-4150-9508-61045ce04922;https://ae01.alicdn.com/kf/H7b2226a52fe04bcebbefca1de28cbcf1H.jpg_350x350.jpg;US $20.26;114 avis positifs;
Global ROM Lenovo Mobile Phone 6GB 64/128GB Smartphone Z5S 6.3 Inch 2340*1080 Rear Camera 16.0MP 8.0MP 5.0MP Octa Core Phones;https://www.aliexpress.com/item/4000049082585.html?gps-id=5950812&scm=1007.23961.125497.0&scm_id=1007.23961.125497.0&scm-url=1007.23961.125497.0&pvid=2b5b0ad0-2dff-4150-9508-61045ce04922;https://ae01.alicdn.com/kf/Hce893e27bb4e436dbac548c9dffa887fB.jpg_350x350.jpg;US $118.07;1739 avis positifs;
35000/20000 RPM Electric Nail Drill Machine Mill Cutter Sets For Manicure Nail Tips Manicure Electric Nail Pedicure File;https://www.aliexpress.com/item/32956937320.html?gps-id=5950812&scm=1007.23961.125497.0&scm_id=1007.23961.125497.0&scm-url=1007.23961.125497.0&pvid=2b5b0ad0-2dff-4150-9508-61045ce04922;https://ae01.alicdn.com/kf/H2f8f8e2ec9f843cabcf0a84d948b4bf3X.jpg_350x350.jpg;US $12.62;10861 avis positifs;Free Return
2019 Original Xiaomi Mi Band 4 In Stock Newest Xiaomi Miband 4 Bracelet Heart Rate Fitness 135mAh Color Screen Bluetooth 5.0;https://www.aliexpress.com/item/33037398915.html?gps-id=5950812&scm=1007.23961.125497.0&scm_id=1007.23961.125497.0&scm-url=1007.23961.125497.0&pvid=2b5b0ad0-2dff-4150-9508-61045ce04922;https://ae01.alicdn.com/kf/H9f295691f4434de1a8180b5c0b1d5f72V.jpg_350x350.jpg;US $24.59;6448 avis positifs;
BGTEEVER Spring Denim Jeans Women Jeans Pants High Waist  Straight Female Loose Denim Pants With Belt 2 Style Thickness 2020;https://www.aliexpress.com/item/4000464426465.html?gps-id=5950812&scm=1007.23961.125497.0&scm_id=1007.23961.125497.0&scm-url=1007.23961.125497.0&pvid=2b5b0ad0-2dff-4150-9508-61045ce04922;https://ae01.alicdn.com/kf/H8e21ce2c317e41daad2d86e599bd9c5co.jpg_350x350.jpg;US $17.39;19 avis positifs;Free Return
Foreverlily 7 Colors Led Facial Mask Led Korean Photon Therapy Face Mask Machine Light Therapy Acne Mask Neck Beauty Led Mask;https://aliexpress.ru/item/32880600969.html?gps-id=5950812&scm=1007.23961.125497.0&scm_id=1007.23961.125497.0&scm-url=1007.23961.125497.0&pvid=2b5b0ad0-2dff-4150-9508-61045ce04922;https://i.alicdn.com/ae-channel-ui/2.0.0/common/img/placeholder.png;US $26.27;968 avis positifs;fast shipping
Mens Joggers Casual Pants Fitness Men Sportswear Tracksuit Bottoms Skinny Sweatpants Trousers Black Gyms Jogger Track Pants;https://www.aliexpress.com/item/4000202954322.html?gps-id=5950812&scm=1007.23961.125497.0&scm_id=1007.23961.125497.0&scm-url=1007.23961.125497.0&pvid=2b5b0ad0-2dff-4150-9508-61045ce04922;https://i.alicdn.com/ae-channel-ui/2.0.0/common/img/placeholder.png;US $9.24;1426 avis positifs;
Лампа светодиодная для автомобильной фары, 72 Вт, 8000 лм;https://www.aliexpress.com/item/32749693992.html?gps-id=5950812&scm=1007.23961.125497.0&scm_id=1007.23961.125497.0&scm-url=1007.23961.125497.0&pvid=2b5b0ad0-2dff-4150-9508-61045ce04922;https://i.alicdn.com/ae-channel-ui/2.0.0/common/img/placeholder.png;US $10.35;12630 avis positifs;
ELERA Baby Thermometer Infrared Digital LCD Body Measurement Forehead Ear Non-Contact Adult Body Fever IR Children  Termometro;https://www.aliexpress.com/item/32967221349.html?gps-id=5950812&scm=1007.23961.125497.0&scm_id=1007.23961.125497.0&scm-url=1007.23961.125497.0&pvid=2b5b0ad0-2dff-4150-9508-61045ce04922;https://i.alicdn.com/ae-channel-ui/2.0.0/common/img/placeholder.png;US $58.99;13865 avis positifs;Free Return
Baseus USB Type C Cable For Samsung S20 S10 Plus Xiaomi Fast Charging Wire Cord USB-C Charger Mobile Phone USBC Type-c Cable 3m;https://www.aliexpress.com/item/32959861025.html?gps-id=5950812&scm=1007.23961.125497.0&scm_id=1007.23961.125497.0&scm-url=1007.23961.125497.0&pvid=2b5b0ad0-2dff-4150-9508-61045ce04922;https://i.alicdn.com/ae-channel-ui/2.0.0/common/img/placeholder.png;US $0.01;19015 avis positifs;Free Return
Foreverlily 7 Colors Led Facial Mask Led Korean Photon Therapy Face Mask Machine Light Therapy Acne Mask Neck Beauty Led Mask;https://aliexpress.ru/item/32880600969.html?gps-id=5950812&scm=1007.23961.125497.0&scm_id=1007.23961.125497.0&scm-url=1007.23961.125497.0&pvid=2b5b0ad0-2dff-4150-9508-61045ce04922;https://ae01.alicdn.com/kf/Haf9af02bdf5140aeb2f46b9b237ba118i.jpg_350x350.jpg;US $26.27;968 avis positifs;fast shipping
Mens Joggers Casual Pants Fitness Men Sportswear Tracksuit Bottoms Skinny Sweatpants Trousers Black Gyms Jogger Track Pants;https://www.aliexpress.com/item/4000202954322.html?gps-id=5950812&scm=1007.23961.125497.0&scm_id=1007.23961.125497.0&scm-url=1007.23961.125497.0&pvid=2b5b0ad0-2dff-4150-9508-61045ce04922;https://ae01.alicdn.com/kf/Hdfd0ccb8f17e4e0bbe2c7f6b7fd0a92az.jpg_350x350.jpg;US $9.24;1426 avis positifs;